{"assumptions":["Ward evaluates supplied service-escrow facts against fixed release rules; it does not judge work quality.","The institution or escrow authority reviews and signs any resulting action externally.","Egregious disputes block the automated release path for party-handled escalation."],"case":{"asset_or_obligation":"services-deposit:design-project-001","case_id":"netten-escrow-001","metadata":{"client":"client-beta","dispute_open":false,"event_id":"netten-services-release-001","ledger_hash":"bbbbbbbbbbbbbbbbbbbbbbbbbbbbbbbbbbbbbbbbbbbbbbbbbbbbbbbbbbbbbbbb","ledger_index":100200300,"release_basis":"client_acceptance","service_provider":"designer-alpha"},"rail":"xrpl","requested_action":"xrpl.escrow_finish","rule_bundle_id":"ward.netten-escrow-release@1.0.0","signer":"rHb9CJAWyB4rj91VRWn96DkukG4bwdtyTh","source_of_truth":"xrpl:ledger/100200300/bbbbbbbbbbbbbbbbbbbbbbbbbbbbbbbbbbbbbbbbbbbbbbbbbbbbbbbbbbbbbbbb/netten-services-release-001","trigger":"services_escrow_release_review","workflow_type":"netten_escrow_release"},"checks":[{"actual":true,"detail":"fixed rule matched","evidence_refs":["escrow_workflow_state"],"expected":true,"field":"deposit.received","operator":"eq","passed":true,"rule_id":"NE-01"},{"actual":true,"detail":"fixed rule matched","evidence_refs":["escrow_workflow_state"],"expected":true,"field":"service.rendered","operator":"eq","passed":true,"rule_id":"NE-02"},{"actual":true,"detail":"fixed rule matched","evidence_refs":["escrow_workflow_state"],"expected":true,"field":"release.authorized","operator":"eq","passed":true,"rule_id":"NE-03"},{"actual":false,"detail":"fixed rule matched","evidence_refs":["escrow_workflow_state"],"expected":false,"field":"dispute.egregious","operator":"eq","passed":true,"rule_id":"NE-04"},{"actual":true,"detail":"fixed rule matched","evidence_refs":["escrow_workflow_state"],"expected":true,"field":"signer.external","operator":"eq","passed":true,"rule_id":"NE-05"}],"decision":"approved","engine_version":"0.2.10","evidence":[{"claims":{"deposit":{"received":true},"dispute":{"egregious":false,"open":false},"escrow":{"client":"client-beta","offer_sequence":7251,"owner":"rPT1Sjq2YGrBMTttX4GZHjKu9dyfzbpAYe","service_provider":"designer-alpha"},"release":{"authorized":true,"basis":"client_acceptance","client_accepted":true,"interval_elapsed":false},"service":{"rendered":true},"signer":{"account":"rHb9CJAWyB4rj91VRWn96DkukG4bwdtyTh","external":true}},"content_hash":"bc4348c36b6b32c478b0def062762ee4b2d219b28b15dd77dc71d382bf6c2f16","finality":"validated","locator":"xrpl:ledger/100200300/bbbbbbbbbbbbbbbbbbbbbbbbbbbbbbbbbbbbbbbbbbbbbbbbbbbbbbbbbbbbbbbb/netten-services-release-001","observed_at":1700000100,"source_id":"escrow_workflow_state","source_type":"escrow_workflow_state"}],"observed_at":1700000100,"receipt_hash":"6cc10faf669ffc3367fedc9a615a07f186b73b304147c0ff24191abf9443f810","receipt_id":"wr_6cc10faf669ffc3367fedc9a","rule_bundle":{"bundle_id":"ward.netten-escrow-release","reference":"ward.netten-escrow-release@1.0.0","require_all":true,"rules":[{"evidence_refs":["escrow_workflow_state"],"expected":true,"field":"deposit.received","operator":"eq","rule_id":"NE-01"},{"evidence_refs":["escrow_workflow_state"],"expected":true,"field":"service.rendered","operator":"eq","rule_id":"NE-02"},{"evidence_refs":["escrow_workflow_state"],"expected":true,"field":"release.authorized","operator":"eq","rule_id":"NE-03"},{"evidence_refs":["escrow_workflow_state"],"expected":false,"field":"dispute.egregious","operator":"eq","rule_id":"NE-04"},{"evidence_refs":["escrow_workflow_state"],"expected":true,"field":"signer.external","operator":"eq","rule_id":"NE-05"}],"version":"1.0.0"},"schema_version":"ward-resolution/v1","unsigned_actions":[{"action_type":"xrpl.escrow_finish","payload":{"Account":"rHb9CJAWyB4rj91VRWn96DkukG4bwdtyTh","OfferSequence":7251,"Owner":"rPT1Sjq2YGrBMTttX4GZHjKu9dyfzbpAYe","TransactionType":"EscrowFinish"},"rail":"xrpl","signer":"rHb9CJAWyB4rj91VRWn96DkukG4bwdtyTh","ward_signed":false}],"ward_signed":false}
